<?xml version="1.0" encoding="UTF-8"?>
<!DOCTYPE companies SYSTEM "companies.dtd">
<companies>
  <company industry="Technology" status="public">
    <name>TechCorp</name>
    <location>New York</location>
    <revenue>5000000</revenue>
    <employees>200</employees>
  </company>
  <company industry="Software" status="private">
    <name>InnoSoft</name>
    <location>San Francisco</location>
    <revenue>3000000</revenue>
    <employees>150</employees>
  </company>
  <company industry="Healthcare" status="public">
    <name>HealthPlus</name>
    <location>Boston</location>
    <revenue>7000000</revenue>
    <employees>350</employees>
  </company>
</companies>
